#,Archetype Name,Named?,RB Strategy,WR Strategy,QB Strategy,TE Strategy,Late Round Philosophy,Flavor Text
1,The Captain,✓,BPA,Robust WR,Early QB,Early TE,Floor,"Pure best-player-available drafting, and the board just happened to deliver an early QB, a premium TE, and a wall of WRs. The Captain leads by example and the draft board set a very good example all night long. No agenda, no bias, just discipline from pick one to the final round."
3,The Opportunist,✓,BPA,Robust WR,Early QB,Early TE,Upside,"Best player available every pick, which naturally produced an early QB, a premium TE, stacked WRs, and boom-or-bust upside late. The Opportunist follows the board wherever it leads and seizes every opening the room creates. The board led somewhere excellent. The Opportunist was ready."
4,The Value GM,✓,BPA,Robust WR,Early QB,Early TE,VBD,"best player available from start to finish, anchored by an early QB, a premium TE, and stacked WRs, with value-based drafting driving every late pick. The Value GM runs the most disciplined front office in the league: no ego, no agenda, just the ranked board. Every pick was optimal. The roster is the proof."
5,The Calculated Risk,✓,BPA,Robust WR,Early QB,Mid TE,Floor,"best player available drafting led naturally to an early QB, stacked WRs, a reliable mid-round TE, and a floor-first backend. The Calculated Risk knew the odds before every pick and only accepted risk when the value justified it. Every gamble was calculated. Every calculation was correct."
363,The Cold Calculation,✓,Zero RB,Hero WR,Mid QB,Stream TE,VBD,"Zero RB with a Hero WR, mid-round QB, streamed TE, and value-based drafting calculating the risk-adjusted return on every backend pick. The Cold Calculation ran the math: Zero RB at the right ADP, Hero WR at the right price, mid-round QB at value, and value-based drafting confirming every subsequent pick. The risk was calculated. The calculation was correct."
7,The Free Agent,✓,BPA,Robust WR,Early QB,Mid TE,Upside,"No positional agenda, the board gave you an early QB, solid WRs, a mid-round TE, and upside all the way down. The Free Agent goes wherever the value is, with no loyalty to any single strategy or position group. The freedom to follow the board is the whole strategy."
8,The Computer,✓,BPA,Robust WR,Early QB,Mid TE,VBD,"Pure best player available every round: early QB, solid WRs, value TE, and value-based drafting driving the entire backend. The Computer processed the board and output the optimal roster without hesitation or second-guessing. There were no emotional picks. The Computer doesn't have emotions."
9,The Scout Team,✓,BPA,Robust WR,Early QB,Stream TE,Floor,"Best player available at every turn, with the board delivering an early QB, strong WR depth, and a reliable bench. The Scout Team did the film work, studied every player, and executed the plan without a single deviation. Preparation plus discipline equals this roster."
11,The Opportunist's Gambit,✓,BPA,Robust WR,Early QB,Stream TE,Upside,"best player available led to an early QB and stacked WRs, then you went after boom-or-bust picks every round after. The Opportunist's Gambit seized every value opening and then swung hard for the fences. Value in the foundation, ceiling in the roof, the complete package."
12,The Evaluator,✓,BPA,Robust WR,Early QB,Stream TE,VBD,"best player available produced an early QB, stacked WRs, a streamed TE, and value-based drafting guiding every late pick without exception. The Evaluator rates every player the same way, objectively, without bias, without sentiment. The evaluation was correct. It always is."
13,The Disciplined,✓,BPA,Robust WR,Late QB,Early TE,Floor,"best player available produced a premium TE, strong WR depth, a late QB at tremendous value, and a reliable conservative bench. The Disciplined never reaches, never panics, and never pays more than a pick is worth. Fifteen rounds of discipline compounds into something very difficult to beat."
15,The Pure Play,✓,BPA,Robust WR,Late QB,Early TE,Upside,"best player available delivered a premium TE, stacked WRs, a late QB at incredible value, and upside picks late. The Pure Play is best player available in its most honest form, no strategy overlaid, no positional agenda imposed. The board ran the draft. The board did well."
16,The Robot,✓,BPA,Robust WR,Late QB,Early TE,VBD,"Best player available, premium TE, stacked WRs, late QB, and value-based drafting closing out the backend with zero emotional picks from start to finish. The Robot will be optimizing lineups in October while everyone else is still second-guessing August. There were no human decisions made in this draft. Only optimal ones."
408,The Automaton,✓,Zero RB,Robust WR,Punt QB,Stream TE,VBD,"Zero RB with heavy Robust WR investment, QB fully punted, streamed TE, and value-based drafting running the backend with automated precision. The Automaton processed every available data point, confirmed the Zero RB directive, executed the QB punt on schedule, and output the optimal value-based drafting roster without a single deviation. No human decisions were made in this draft. Only optimal ones."
17,The Stabilizer,✓,BPA,Robust WR,Late QB,Mid TE,Floor,"best player available gave you stacked WRs, a solid mid-round TE, a late QB at great value, and a reliable conservative bench. The Stabilizer keeps everything running smoothly through every storm the season can throw at it. It cannot be destabilized. That's the whole point."
73,The Ballast,✓,BPA,WR Late,Mid QB,Early TE,Floor,"best player available gave you a premium TE, a reliable mid-round QB, late WRs, and a dependable floor-first bench. The Ballast keeps the roster balanced and the floor elevated through every injury, bye week, and cold stretch. It cannot be shaken. It will not be moved."
19,The Sleeper,✓,BPA,Robust WR,Late QB,Mid TE,Upside,"best player available produced stacked WRs and a patient QB strategy, then you chased upside picks all the way to the final round. The Sleeper is the team nobody remembers drafting until week 7, when everyone suddenly remembers it. It was hiding in plain sight the entire time."
20,The Formula,✓,BPA,Robust WR,Late QB,Mid TE,VBD,"best player available, stacked WRs, late QB at value, mid-round TE, and value-based drafting all the way to the final pick, a proven equation. The Formula has been backtested extensively and the results are consistently excellent. Trust the formula. The formula works."
360,The Proof,✓,Zero RB,Hero WR,Mid QB,Mid TE,VBD,"Zero RB anchored by a Hero WR, mid-round QB, mid-round TE, and value-based drafting driving every pick from round five onward. The Proof is the same equation as always, avoid the position with the highest injury rate and let the passing game do the heavy lifting. The math has not changed. It still works."
21,The Scout,✓,BPA,Robust WR,Late QB,Stream TE,Floor,"Pure best player available, stacked WRs, late QB at tremendous value, stream TE, and a steady floor-first backend. The Scout did the homework long before the draft started and trusted it all the way through. The preparation is visible in every single pick."
132,The Talent Evaluator,✓,Hero RB,Robust WR,Mid QB,Stream TE,VBD,"Hero RB anchored by a workhorse back, Robust WR depth alongside it, mid-round QB, streamed TE, and value-based drafting precision late. The Talent Evaluator did the film work before the draft started and trusted it through every round. Every pick is defensible. The tape doesn't lie."
23,The Value Hunter,✓,BPA,Robust WR,Late QB,Stream TE,Upside,"best player available, stacked WRs, late QB at maximum value, stream TE, and boom-or-bust picks filling the bench. The Value Hunter finds diamonds even in the final five rounds, every round is an opportunity. Every opportunity was seized."
207,The Prospector,✓,Robust RB,Hero WR,Late QB,Mid TE,VBD,"Robust RB paired with a Hero WR, late QB taken at tremendous value, mid-round TE, and value-based drafting guiding the backend without exception. The Prospector finds the mispriced asset at every position and takes it before anyone else identifies the opportunity. The value was there. It always is."
24,The Analyst,✓,BPA,Robust WR,Late QB,Stream TE,VBD,"best player available, stacked WRs, late QB at value, stream TE, and value-based drafting driving every single late pick. The Analyst turned the entire draft into a research project, and produced a research-grade roster. The findings were published in every selection."
116,The Examiner,✓,Hero RB,Robust WR,Late QB,Mid TE,VBD,"Hero RB with stacked WRs, a late QB at maximum value, mid-round TE, and value-based drafting pulling the backend into shape. The Examiner ran the numbers on every position, every round, and produced a roster where every pick makes sense on paper. The analysis was thorough. The roster is the report."
25,The Steady Hand,✓,BPA,Robust WR,Mid QB,Early TE,Floor,"Pure value drafting gave you a premium TE, solid WRs, a reliable mid-round QB, and steady dependable depth. The Steady Hand never flinched, never panicked, and never once deviated from the ranked list. This is what composure looks like across fifteen rounds."
117,The Ironhand,✓,Hero RB,Robust WR,Late QB,Stream TE,Floor,"Hero RB paired with deep WR investment, a late QB taken at a discount, streamed TE, and floor-first depth throughout. The Ironhand built this team to survive the season without drama, no boom weeks required, no busts tolerated. Fifteen rounds of composure. The composure shows."
27,The Market Timer,✓,BPA,Robust WR,Mid QB,Early TE,Upside,"best player available produced a premium TE, stacked WRs, a QB grabbed at the perfect moment, and upside picks late. The Market Timer knew exactly when to pull the trigger at every position, the timing was impeccable. Patience plus preparation equals perfect execution."
164,The Window Spotter,✓,Hero RB,WR Late,Late QB,Mid TE,VBD,"Hero RB leading the way, WRs taken late and at value, late QB at a discount, mid-round TE, and value-based drafting as the closing philosophy. The Window Spotter knows when every position peaks in value and drafts accordingly, patience is the edge, timing is the weapon. Every trigger was pulled at the right moment."
28,The Accountant,✓,BPA,Robust WR,Mid QB,Early TE,VBD,"best player available all the way, with a premium TE, stacked WRs, mid-round QB, and value-based drafting tracking every late pick. The Accountant ran the draft like a balance sheet, every pick measured against its replacement cost. The books are balanced. The roster is excellent."
384,The Ledger,✓,Zero RB,Robust WR,Late QB,Early TE,VBD,"Zero RB alongside deep Robust WR investment, late QB at tremendous value, premium early TE, and value-based drafting tracking the backend. The Ledger tracked the cost basis on every pick. Zero RB as the value position, stacked WRs as the appreciating asset, late QB as the undervalued holding, and value-based drafting balancing the books. The books are clean."
29,The Even Keel,✓,BPA,Robust WR,Mid QB,Mid TE,Floor,"Pure value drafting created a balanced, reliable roster with no obvious weakness anywhere on the board. The Even Keel never panics, never overreacts, and never makes a pick it has to defend later. Because there is nothing to panic about."
31,The Sleeper Agent,✓,BPA,Robust WR,Mid QB,Mid TE,Upside,"best player available produced stacked WRs and a reliable mid-round QB and TE, then you chased upside all the way down. The Sleeper Agent blends into the background completely, unnoticed and underestimated. Until October. Then everyone notices."
32,The Neutral,✓,BPA,Robust WR,Mid QB,Mid TE,VBD,"best player available from start to finish, mid-round QB and TE, stacked WRs, and value-based drafting driving every late pick. The Neutral has no agenda, no positional bias, and no emotional attachment to any strategy. Just the ranked list and the discipline to follow it."
33,The Indexer,✓,BPA,Robust WR,Mid QB,Stream TE,Floor,"best player available produced stacked WRs, a reliable mid-round QB, a streamed TE, and a dependable conservative bench. The Indexer tracks the market and buys everything at fair value, no premiums, no discounts, no deviations. Fair value. Every single round."
35,The Pivot,✓,BPA,Robust WR,Mid QB,Stream TE,Upside,"best player available naturally built a WR-heavy team with a reliable mid-round QB, and then pivoted hard to upside late. The Pivot adapts to the board, always, and always finds a new angle worth exploiting. Flexibility is the strategy. The strategy is excellent."
75,The Redirect,✓,BPA,WR Late,Mid QB,Early TE,Upside,"best player available produced a premium TE and a mid-round QB, with WRs deferred, then you pivoted hard to upside late. The Redirect adapts to the board in real time and always finds a new angle that the room missed. The ability to change direction is the whole advantage."
36,The Spreadsheet Classic,✓,BPA,Robust WR,Mid QB,Stream TE,VBD,"Pure best player available, stacked WRs, mid-round QB, stream TE, and value-based drafting all the way to the final round. The Spreadsheet Classic is what happens when you trust the model completely and never deviate once. The model was right. The model is always right."
37,The Safe Harbor,✓,BPA,Robust WR,Punt QB,Early TE,Floor,"best player available, premium TE, stacked WRs, punted QB, and a reliable dependable bench to anchor everything. The Safe Harbor is your port in a storm, stable, anchored, and impossible to rattle by midseason. When the season gets turbulent, this team holds course."
39,The Chaos Agent,✓,BPA,Robust WR,Punt QB,Early TE,Upside,"best player available led to stacked WRs, a premium TE, a punted QB, and boom-or-bust picks filling the backend. The Chaos Agent followed the board wherever it went, and it went somewhere genuinely interesting. The chaos wasn't planned. It was discovered. And it's magnificent."
40,The Actuarial,✓,BPA,Robust WR,Punt QB,Early TE,VBD,"best player available, premium TE, stacked WRs, punted QB, and value-based drafting all the way to the final pick. The Actuarial calculated the expected value of punting QB versus drafting one early, and the math supported the decision. It was a data-driven conclusion. The data was correct."
222,The Underwriter,✓,Robust RB,Hero WR,Punt QB,Early TE,VBD,"Robust RB with a Hero WR riding alongside it, full QB punt, premium early TE, and value-based drafting extracting every available drop of value late. The Underwriter ran the probability tables on every possible build and determined this combination produces the best expected outcomes. The actuary's table doesn't care about feelings. Just frequency."
41,The Minimalist,✓,BPA,Robust WR,Punt QB,Mid TE,Floor,"best player available, stacked WRs, mid-round TE, punted QB, and a lean reliable backend with no wasted spots. The Minimalist cut everything that isn't essential and built a clean, functional, no-nonsense roster. Less is more, especially at quarterback."
403,The Spartan Draft,✓,Zero RB,Robust WR,Punt QB,Mid TE,Floor,"Zero RB with heavy Robust WR depth, QB punt, mid-round TE, and a floor-first backend stripped to the essentials. The Spartan Draft removes every non-essential from the draft strategy. Zero RB is the essential starting point, stacked WRs are the essential asset, and the floor-first backend is the essential safety margin. Minimal. Essential. Correct."
43,The Pure Opportunist,✓,BPA,Robust WR,Punt QB,Mid TE,Upside,"best player available produced stacked WRs and a mid-round TE, then you punted QB and took shots on upside everywhere. The Pure Opportunist seizes every opening the board presents without hesitation or second-guessing. Every round had an opportunity. Every opportunity was captured."
44,The Algorithm,✓,BPA,Robust WR,Punt QB,Mid TE,VBD,"best player available, stacked WRs, mid-round TE, punted QB, and value-based drafting driving every remaining pick, zero human error. The Algorithm doesn't need intuition, hunches, or gut feelings. It has a ranked list. The ranked list was followed to the letter."
405,The Cipher,✓,Zero RB,Robust WR,Punt QB,Mid TE,VBD,"Zero RB with deep Robust WR investment, QB fully punted, mid-round TE, and value-based drafting running the backend with algorithmic precision. The Cipher processed every pick through the Zero RB model, confirmed the value-based outputs at every position, and executed without emotional interference from start to finish. The algorithm ran correctly. The roster is the output."
45,The Monk,✓,BPA,Robust WR,Punt QB,Stream TE,Floor,"best player available, stacked WRs, punted QB, stream TE, and a steady conservative bench built with complete calm. The Monk is devoted to the process and the process alone, no deviations, no compromises, no noise. The process was followed. The results will follow."
220,The Ascetic,✓,Robust RB,Hero WR,Punt QB,Early TE,Floor,"Robust RB paired with a Hero WR, full QB punt accepted, premium early TE investment, and a floor-first conservative backend. The Ascetic drafts without ego, without noise, and without the temptation to overcomplicate what already works. Silence and discipline. The roster reflects both."
47,The Iconoclast,✓,BPA,Robust WR,Punt QB,Stream TE,Upside,"best player available led to stacked WRs, punted QB, stream TE, and boom-or-bust picks, all by pure board logic. The Iconoclast breaks convention without even trying, the board just took it somewhere unconventional. The result is unorthodox. The process was pure."
221,The Heretic,✓,Robust RB,Hero WR,Punt QB,Early TE,Upside,"Robust RB with a Hero WR running alongside it, QB punted entirely, premium early TE, and boom-or-bust upside picks filling the backend. The Heretic rejects every convention that doesn't make mathematical sense and builds the team the field is too timid to draft. Convention is overrated. The ceiling is not."
48,The Spartan Analyst,✓,BPA,Robust WR,Punt QB,Stream TE,VBD,"best player available, stacked WRs, punted QB, stream TE, and value-based drafting all the way to the final pick without a single detour. The Spartan Analyst is lean, efficient, completely unemotional, and mathematically correct at every turn. The ranked list was the only voice in the draft room."
49,The Commander in Chief,✓,BPA,WR Late,Early QB,Early TE,Floor,"best player available naturally delivered an early QB and a premium TE before WRs entered the picture, then a reliable floor-first bench. The Commander in Chief runs the most organized operation in the league, with premium picks at the two positions that matter most. This is the draft of someone who walked in with a hierarchy and executed it perfectly."
156,The Dispatch,✓,Hero RB,WR Late,Early QB,Stream TE,VBD,"Hero RB paired with late WRs, early QB priority, streamed TE, and value-based drafting providing direction through every backend round. The Dispatch runs the draft room with authority, every pick serves the roster strategy, no exceptions made, no deviations tolerated. The command was total. The roster reflects it."
51,The Field General,✓,BPA,WR Late,Early QB,Early TE,Upside,"best player available gave you an early QB, a premium TE, late WRs, and boom-or-bust upside picks filling the bench. The Field General commands from the most important positions on the field and dares everything else to keep up. Premium at QB and TE, ceiling everywhere else."
153,The Commanding Officer,✓,Hero RB,WR Late,Early QB,Stream TE,Floor,"Hero RB with WRs taken late, early QB locked in, streamed TE, and a floor-first backend built for durability. The Commanding Officer commands the roster from the front, sets the tone with the RB anchor, and keeps every position group disciplined. The general leads from the top. The roster follows."
52,The Strategist,✓,BPA,WR Late,Early QB,Early TE,VBD,"best player available, early QB, premium TE, late WRs, and value-based drafting driving every pick from round 5 onward. The Strategist sees three moves ahead and executes each one before the rest of the room catches on. This draft was pre-planned, the plan was excellent, and it was followed exactly."
152,The Planner,✓,Hero RB,WR Late,Early QB,Mid TE,VBD,"Hero RB with late WRs, early QB secured, mid-round TE, and value-based drafting closing out the backend. The Planner mapped the draft before the first pick and executed a plan that balanced every position group without compromise. The board was a chessboard. Every move was calculated."
53,The Even Hand,✓,BPA,WR Late,Early QB,Mid TE,Floor,"Pure best player available gave you an early QB, a reliable mid-round TE, late WRs, and a floor-first steady bench. The Even Hand never shows favoritism, not to positions, not to players, not to trends. The board was the only deciding voice."
55,The Opportunist's Mirror,✓,BPA,WR Late,Early QB,Mid TE,Upside,"best player available produced an early QB and a mid-round TE. WRs were deferred late, then upside picks all the way down. The Opportunist's Mirror reflects the board back at you with no filter and no preconceptions. The board said this was the right draft. The board was right."
56,The Systems Thinker,✓,BPA,WR Late,Early QB,Mid TE,VBD,"best player available, early QB, value TE, late WRs, and value-based drafting late, every pick part of a larger interconnected system. The Systems Thinker sees how each selection affects every other selection on the roster. The system works. It always works."
57,The Deliberate,✓,BPA,WR Late,Early QB,Stream TE,Floor,"Pure best player available, early QB, stream TE, late WRs, and a reliable floor-first bench, not a single rushed pick. The Deliberate took its time at every selection and never made a hasty or reactionary decision. Every pick was considered. Every pick was correct."
59,The Open Field,✓,BPA,WR Late,Early QB,Stream TE,Upside,"best player available led to an early QB, stream TE, late WRs, and boom-or-bust picks attacking from every angle. The Open Field found space the rest of the room missed, every single round, without fail. There is always an open receiver if you know where to look."
60,The Draft Engine,✓,BPA,WR Late,Early QB,Stream TE,VBD,"best player available, early QB, stream TE, late WRs, and value-based drafting driving every pick, a perpetual motion machine of value. The Draft Engine never stalls, never misfires, and never wastes a selection. It ran all fifteen rounds without a single hiccup."
61,The Quiet Storm,✓,BPA,WR Late,Late QB,Early TE,Floor,"best player available produced a premium TE, late QB at great value, late WRs, and a dependable floor-first bench. The Quiet Storm doesn't announce itself in August, it just keeps winning quietly until October when everyone notices. It was coming the whole time."
223,The Grinding Stone,✓,Robust RB,Hero WR,Punt QB,Mid TE,Floor,"Robust RB with a Hero WR anchor, QB fully punted, mid-round TE, and a floor-first backend built to grind through the entire schedule. The Grinding Stone doesn't need a splash moment, it accumulates quietly and is difficult to beat by week twelve. Nobody sees it coming until it's too late."
63,The Maverick's Twin,✓,BPA,WR Late,Late QB,Early TE,Upside,"best player available gave you a premium TE, a late QB at tremendous value, late WRs, and boom-or-bust picks late. The Maverick's Twin plays by entirely different rules and still arrives at the same destination, a strong roster. Same destination, completely different route."
64,The Logician,✓,BPA,WR Late,Late QB,Early TE,VBD,"best player available, premium TE, late QB at maximum value, late WRs, and value-based drafting all the way to the final pick. The Logician can defend every single selection with cold, hard data and does not apologize for a single one. The logic is airtight. The roster reflects that."
354,The Rationalist,✓,Zero RB,Hero WR,Late QB,Stream TE,VBD,"Zero RB with a Hero WR, late QB at tremendous value, streamed TE, and value-based drafting conducting a precise logical analysis at every backend pick. The Rationalist identifies the Zero RB thesis as the most defensible strategic position in fantasy and applies formal logic to every subsequent selection, the late QB is the next logical step, and value-based drafting is the proof of concept. The logic was sound."
65,The Pragmatist,✓,BPA,WR Late,Late QB,Mid TE,Floor,"best player available gave you a value TE, a late QB, late WRs, and a reliable floor-first bench that never lets you down. The Pragmatist does what works, not what's exciting, and what works is building a dependable roster. Every pick served a purpose."
352,The Measured,✓,Zero RB,Hero WR,Late QB,Stream TE,Floor,"Zero RB with a Hero WR, late QB at a discount, streamed TE, and a floor-first backend built on pragmatic selection principles. The Measured makes the most defensible picks without requiring them to be exciting. Zero RB is the pragmatic stance on RB scarcity, late QB is the pragmatic value find, and the floor-first backend is the pragmatic finish. Practical. Correct."
67,The Free Thinker,✓,BPA,WR Late,Late QB,Mid TE,Upside,"best player available, mid-round TE, late QB at value, late WRs, and boom-or-bust picks filling the entire bench. The Free Thinker doesn't follow a strategy, it builds one from scratch every single draft. The result is always original and usually excellent."
68,The Cold Eye,✓,BPA,WR Late,Late QB,Mid TE,VBD,"best player available, mid-round TE, late QB at maximum value, late WRs, and value-based drafting driving every remaining pick. The Cold Eye sees the board with total clarity, no emotion, no sentiment, no clouded judgment. This is what objectivity looks like across fifteen rounds."
