#,Archetype Name,Named?,RB Strategy,WR Strategy,QB Strategy,TE Strategy,Late Round Philosophy,Flavor Text
298,The Minimalist Extreme,✓,Hybrid,WR Late,Punt QB,Stream TE,Floor,"Running backs and wide receivers filled every early round slot in a committed skill position build, with both the tight end and quarterback left entirely to streaming and the final rounds, stripping the roster to its absolute minimum non-skill investment. The Minimalist Extreme removes every luxury position from the draft strategy and concentrates entirely on the RB and WR depth that wins weekly matchups. Minimum supporting cast. Maximum skill position depth."
299,The Total Chaos,✓,Hybrid,WR Late,Punt QB,Stream TE,Upside,"Skill positions dominated every early round in a deliberate RB and WR rotation, with the tight end streamed late and the quarterback punted to the very final rounds, creating maximum variance at both non-skill positions simultaneously. The Total Chaos built the disorder intentionally, the skill position base is the structure and the punted QB, streamed TE, and upside backend are the accelerant. Total commitment. Total chaos. The skill positions hold it together."
300,The Pure Contrarian,✓,Hybrid,WR Late,Punt QB,Stream TE,VBD,"Running backs and wide receivers were the exclusive focus of the first six rounds in a pure skill position build, with the tight end streamed late and the quarterback punted to the final rounds, leaving value-based drafting to extract every unit of value from a non-skill-heavy backend. The Pure Contrarian disagrees with the conventional wisdom that both QB and TE require real investment and builds the mathematical proof in real time. The skill positions are the argument. The contrarian was right."
301,The Premium Build,✓,Hybrid,WR Mid,Early QB,Early TE,Floor,"Running backs and wide receivers rotated through the first six rounds in a balanced skill position build, with a quarterback and tight end both secured early after falling well past their consensus draft positions, and WRs revisited in the middle rounds to complete the receiving corps. The Premium Build breaks the pure skill position script only when both non-skill positions present themselves at undeniable value simultaneously, then rebuilds the WR foundation in the mid rounds. The floor-first backend is the reward for executing the opportunistic early investments correctly."
302,The Kelce-Allen Special,✓,Hybrid,WR Mid,Early QB,Early TE,Upside,"The first six rounds were a deliberate RB and WR mix before a quarterback and tight end, both falling significantly past their expected ADP, made the early investment a no-brainer, with WRs circled back to in the middle rounds to fill out the receiving corps. The Kelce-Allen Special is named for the combination nobody turns down when the price is right: an elite signal-caller and a dominant tight end, both at a discount, surrounded by a skill position foundation built to support them. The special was worth every pick it cost."
303,The Non-Conformist,✓,Hybrid,WR Mid,Early QB,Early TE,VBD,"Skill positions drove the early rounds in an intentional RB and WR rotation, with a quarterback and tight end both secured early only because the board offered them at prices well below their consensus value, and WRs revisited mid-draft to complete the foundation. The Non-Conformist refuses to follow any script that does not survive contact with the actual draft board, and if both QB and TE fall to value in the early rounds, the non-conformist takes both and adjusts. Value-based drafting confirms every deviation was correct."
304,The Unorthodox,✓,Hybrid,WR Mid,Early QB,Mid TE,Floor,"Running backs and wide receivers were stacked through the first six rounds with an RB lean in the early picks, interrupted by a quarterback who fell well past his ADP making the early investment impossible to decline, and the tight end added mid-draft once the skill position base was set. The Unorthodox takes the unconventional path when the board presents it and then builds a floor-first backend that makes the whole structure more stable than it looked at the time. Unorthodox entry. Reliable finish."
305,The Upside Down,✓,Hybrid,WR Mid,Early QB,Mid TE,Upside,"The early rounds were a deliberate skill position rotation before a quarterback secured an early spot after falling well past consensus, with WRs compensating in the middle rounds and a mid-round tight end completing the supporting cast. The Upside Down flips the expected draft sequence, the QB comes earlier than planned because the board said so, the WRs come later to compensate, and the upside backend is the natural result of a roster built backwards from the conventional order. Upside down. Still correct."
306,The Contrarian Formula,✓,Hybrid,WR Mid,Early QB,Mid TE,VBD,"Skill positions headlined the first six rounds in a balanced RB and WR build, with a quarterback secured early when the value fell significantly past his consensus, and a mid-round tight end added once the skill position priority was fully satisfied. The Contrarian Formula proves the math: an early QB at a steep discount plus a mid-round TE at value plus a skill position foundation equals a roster the room did not expect and cannot easily beat. The formula is contrarian. The formula is correct."
307,The Steady Signal,✓,Hybrid,WR Mid,Early QB,Stream TE,Floor,"Running backs and wide receivers were the early round priority in a deliberate skill position mix, with a quarterback secured early when the board presented him well below his ADP, and the tight end left to streaming and late rounds. The Steady Signal locks in the signal-caller early only because the price was undeniable, then returns to the skill position rhythm for the rest of the draft. The floor-first backend keeps the transmission reliable every week of the season."
308,The Air Strike,✓,Hybrid,WR Mid,Early QB,Stream TE,Upside,"The early rounds were a calculated RB and WR rotation before a quarterback who fell well past his consensus value secured an early spot, with WRs revisited in the middle rounds and the tight end left entirely to streaming. The Air Strike leads with skill positions, takes the opportunistic early QB when the board forces the decision, and fires upside shots through every remaining backend slot. The strike was aerial from the moment the QB came off the board early."
309,The Quarterback First,✓,Hybrid,WR Mid,Early QB,Stream TE,VBD,"Skill positions drove the first six rounds in an intentional RB and WR mix, with a quarterback secured early after falling significantly below his expected draft position, and the tight end left to the wire and late picks. The Quarterback First broke the skill-position-only early script because the signal-caller was simply too cheap to pass up, and then returned to WRs mid-draft to complete the receiving corps. Value-based drafting closes a roster where the QB investment was the most defensible pick of the night."
310,The Safe Premium,✓,Hybrid,WR Mid,Late QB,Early TE,Floor,"Running backs and wide receivers rotated through the first six rounds in a balanced skill position build, with a tight end secured early after falling well past his ADP, WRs revisited in the middle rounds, and the quarterback left patiently to the backend where value was waiting. The Safe Premium pays the early TE price only because the board made it a discount, manages the WR mid strategy and defers the QB to maximum value late. Safe premium where it counted. Patience everywhere else."
311,The Premium TE Play,✓,Hybrid,WR Mid,Late QB,Early TE,Upside,"The early rounds were a deliberate RB and WR rotation before a tight end who fell well past his consensus value justified an early investment, WRs were revisited mid-draft, and the quarterback was left all the way to the late rounds. The Premium TE Play centers the early non-skill investment entirely on the tight end advantage, the QB can wait because the TE cannot be replicated at that price anywhere else in the draft. The TE advantage was real. The patience at QB confirmed it."
312,The TE Premium Value,✓,Hybrid,WR Mid,Late QB,Early TE,VBD,"Skill positions led the early rounds in an intentional mix of RBs and WRs, with a tight end secured early when the value dropped far past his ADP, WRs circled back to in the middle rounds, and the quarterback found late where value-based drafting identified the correct price. The TE Premium Value identifies the early TE as the single best non-skill investment available and prices the QB accordingly, the later the better, as long as the value is there. The premium was in the TE. Value-based drafting confirmed the rest."
313,The Patient,✓,Hybrid,WR Mid,Late QB,Mid TE,Floor,"Running backs and wide receivers dominated the first six rounds in a balanced skill position build, with WRs revisited mid-draft after the early RB lean, the tight end added in the same mid-round window, and the quarterback deferred patiently to the late rounds. The Patient builds the skill position foundation without rushing any supporting role, the mid-round TE arrives when the value is right, the late QB arrives even later, and the floor-first backend confirms that patience was rewarded at every position."
314,The Gambler's Process,✓,Hybrid,WR Mid,Late QB,Mid TE,Upside,"Skill positions headlined the early rounds in a deliberate RB and WR rotation, with WRs revisited in the middle rounds, a mid-round tight end added at value, and the quarterback left to the late rounds where the value-conscious drafter waits for the right price. The Gambler's Process runs the numbers on the late QB and mid-round TE, identifies both as correct value plays, and backs the analysis with upside picks in the backend. The process identified the gambles. Every gamble was taken."
315,The Efficiency Expert,✓,Hybrid,WR Mid,Late QB,Mid TE,VBD,"Running backs and wide receivers were loaded up through the first six rounds in a deliberate skill position mix, with WRs supplemented mid-draft, the tight end addressed in the same mid-round window, and the quarterback taken late where the efficiency calculation pays off most. The Efficiency Expert measures every pick by value generated per draft position and confirms that the late QB approach produces the best efficiency score of any quarterback strategy. The skill positions are the engine. Efficiency is the fuel."
316,The Patient Builder,✓,Hybrid,WR Mid,Late QB,Stream TE,Floor,"The early rounds were an intentional RB and WR rotation, with WRs revisited in the middle rounds after the early RB lean, the tight end left to streaming and late picks, and the quarterback deferred all the way to the backend where the patient drafter waits for value. The Patient Builder lays one skill position at a time and does not address the QB or TE until the foundation is complete and the correct price presents itself. Built slowly. Built correctly."
317,The Late Skill Surge,✓,Hybrid,WR Mid,Late QB,Stream TE,Upside,"Skill positions dominated the early rounds in a balanced RB and WR build, with WRs circled back to mid-draft, the tight end streamed late, and the quarterback left deep into the backend where the informed late drafter knows something the rest of the room does not. The Late Skill Surge returns to WRs mid-draft to compensate for the early RB lean and then unleashes upside picks in the backend after the QB is secured at a price nobody else was willing to wait for. The surge was always coming. It arrived on schedule."
318,The Optimizer's Path,✓,Hybrid,WR Mid,Late QB,Stream TE,VBD,"Running backs and wide receivers were the early round priority in a deliberate skill position mix, with WRs revisited in the middle rounds, the tight end left to streaming, and the quarterback taken late where the optimizer found the most efficient path to a starting signal-caller. The Optimizer's Path runs every draft decision through the efficiency filter and confirms that late QB, mid WR, and streamed TE is the most defensible route to a complete skill-position-heavy roster. The optimizer found the path. Value-based drafting confirmed it."
319,The Cautious Premium,✓,Hybrid,WR Mid,Mid QB,Early TE,Floor,"Running backs and wide receivers rotated through the first six rounds in a balanced skill position build, with a tight end secured early when the board offered him well past his consensus value, and the quarterback addressed carefully in the middle rounds. The Cautious Premium breaks the pure late non-skill script only for the early TE, and only because the price demanded it, then manages both positions conservatively from there with a floor-first backend. Premium where warranted. Caution everywhere else."
320,The TE Believer,✓,Hybrid,WR Mid,Mid QB,Early TE,Upside,"Skill positions drove the early rounds in a deliberate RB and WR rotation, with a tight end who fell well past his ADP secured early as the lone non-skill exception, and the quarterback added in the middle rounds after the skill position foundation was in place. The TE Believer builds the draft identity around the elite tight end advantage and backs the belief by taking the TE early at a discount the rest of the room left on the table. The belief was correct. The mid-round QB confirmed the patience."
321,The Balanced Premium,✓,Hybrid,WR Mid,Mid QB,Early TE,VBD,"Running backs and wide receivers headlined the first six rounds in an intentional skill position mix, with a tight end secured early after falling well past his expected draft position, and the quarterback added in the middle rounds at a price that balanced the early TE investment. The Balanced Premium pays for the opportunistic early TE and manages the QB efficiently in the mid rounds, then closes with value-based drafting in the backend. Balanced inputs. Premium outputs."
322,The Patient Drafter,✓,Hybrid,WR Mid,Mid QB,Mid TE,Floor,"The early rounds were a deliberate RB and WR rotation before the middle rounds addressed both the tight end and quarterback at measured prices, with WRs revisited mid-draft to compensate for the early RB lean. The Patient Drafter evaluates every non-skill position before committing and never addresses them before the skill position foundation justifies it. The mid-round QB and TE arrived exactly when the patient drafter determined they should. Not a round earlier."
323,The Slow Burn,✓,Hybrid,WR Mid,Mid QB,Mid TE,Upside,"Skill positions dominated the early rounds in a balanced RB and WR build, with both the tight end and quarterback addressed in the middle rounds after the skill position priority was satisfied, and WRs revisited mid-draft to round out the receiving corps. The Slow Burn is designed to peak in the second half, the mid-round QB and TE develop over the first few weeks, the WRs hit their stride mid-season, and the upside backend picks ignite when the schedule opens up. The burn is slow. The fire gets large."
324,The Contrarian BPA,✓,Hybrid,WR Mid,Mid QB,Mid TE,VBD,"Running backs and wide receivers were stacked in the early rounds in a deliberate skill position mix, with WRs revisited mid-draft, both the tight end and quarterback addressed in the same mid-round window, and value-based drafting running the backend with a contrarian view of what each position is actually worth. The Contrarian BPA rejects the room's consensus at every tier and builds the board independently, the mid-round QB and TE were both taken against the grain and both represent the correct price. The contrarian was right. Value-based drafting is the proof."
325,The Deliberate Builder,✓,Hybrid,WR Mid,Mid QB,Stream TE,Floor,"The early rounds were a methodical RB and WR rotation, with WRs added mid-draft after the early RB lean, both the quarterback and tight end addressed deliberately in the middle rounds at defensible prices, and a floor-first backend closing the roster out. The Deliberate Builder makes no pick without a reason and produces a complete skill-position-heavy roster where every selection can be defended with evidence. Nothing was rushed. The deliberation produced exactly this."
326,The Delayed Attack,✓,Hybrid,WR Mid,Mid QB,Stream TE,Upside,"Skill positions led the early rounds in an intentional RB and WR build, with the mid-round window handling both the quarterback and tight end at value, WRs revisited mid-draft, and upside picks executing a delayed offensive strategy through the backend. The Delayed Attack conserves the early picks entirely for skill positions and then attacks with the mid-round non-skill investments and backend swings at maximum variance. The attack was delayed. It arrived with force."
327,The Process,✓,Hybrid,WR Mid,Mid QB,Stream TE,VBD,"Running backs and wide receivers dominated the first six rounds in a balanced skill position rotation, with WRs revisited mid-draft, both the quarterback and tight end addressed in the middle rounds at the correct price, and value-based drafting running the process through the entire backend. The Process does not require a complicated strategy, skill positions early, QB and TE at mid-round value, value-based drafting to close, and it produces a complete roster where every pick is defensible. Trust the process."
328,The TE Anchor,✓,Hybrid,WR Mid,Punt QB,Early TE,Floor,"Running backs and wide receivers were loaded up through the first six rounds in a deliberate skill position build, with a tight end secured early after falling well past his consensus value, WRs revisited mid-draft, and the quarterback punted entirely to the final rounds before the kicker and defense slots. The TE Anchor holds the early TE investment as the lone exception to the punt-everything-non-skill philosophy and builds the floor-first backend knowing the signal-caller will be a late afterthought. Anchored to the TE. Everything else is secondary."
329,The TE Truther,✓,Hybrid,WR Mid,Punt QB,Early TE,Upside,"Skill positions dominated the early rounds in an intentional RB and WR rotation, with a tight end secured early when the board presented him well below his expected ADP, WRs circled back to mid-draft, and the quarterback deferred entirely to the punt window in the final rounds. The TE Truther believes the elite tight end is the only non-skill position worth early investment and proves it by punting the QB entirely and letting the skill position foundation carry every other week. The TE advantage is real. The truther punted everything else to prove it."
330,The TE Value Hunter,✓,Hybrid,WR Mid,Punt QB,Early TE,VBD,"Running backs and wide receivers were the exclusive early round focus before a tight end who fell well past his consensus value earned an early spot as the one non-skill exception, WRs were revisited mid-draft, and the quarterback was left entirely to the final rounds. The TE Value Hunter identified the premium tight end as the most exploitable value in the non-skill tier and punted the QB to maximize the skill position depth surrounding it. Value-based drafting confirmed every remaining decision. The value was there. The hunter found it."
331,The Grinder's Path,✓,Hybrid,WR Mid,Punt QB,Mid TE,Floor,"Skill positions headlined every early round in a deliberate RB and WR mix, with WRs revisited mid-draft after the early RB lean, the tight end added in the middle rounds, and the quarterback punted all the way to the final rounds before the kicker and defense are selected. The Grinder's Path accepts the discomfort of a punted QB, builds maximum skill position depth in the early and middle rounds, and grinds through the season on the strength of the RB and WR foundation. The path is long. The grinder finishes it."
332,The Hail Mary,✓,Hybrid,WR Mid,Punt QB,Mid TE,Upside,"Running backs and wide receivers were stacked in the early rounds in a balanced skill position build, with WRs revisited mid-draft, the tight end addressed in the middle rounds, and the quarterback thrown to the very end of the draft where boom-or-bust upside picks have already taken over. The Hail Mary punts the signal-caller and swings for the fences with every late pick including the QB slot itself. Multiple positions are in the air simultaneously. The skill position foundation is the only sure thing."
333,The Uncommon Value,✓,Hybrid,WR Mid,Punt QB,Mid TE,VBD,"Skill positions led the early rounds in an intentional RB and WR rotation, with WRs added mid-draft, a mid-round tight end secured at value, and the quarterback punted to the final rounds where value-based drafting identifies the most defensible late signal-caller available. The Uncommon Value finds the pick the room consistently misprices at every position, the mid-round TE, the punted QB, and every value-based backend selection, and takes it without hesitation. Uncommon picks. Common wins."
334,The Minimalist Builder,✓,Hybrid,WR Mid,Punt QB,Stream TE,Floor,"Running backs and wide receivers were the exclusive early round priority in a deliberate skill position build, with WRs revisited mid-draft, the tight end and quarterback both left to the absolute minimum investment late, and a floor-first backend stripping the roster to its most efficient possible form. The Minimalist Builder removes every unnecessary premium from the strategy, concentrates all draft capital in the skill position tiers, and constructs the most floor-stable roster possible with what remains. Minimum non-skill investment. Maximum skill position depth."
335,The Chaos Builder,✓,Hybrid,WR Mid,Punt QB,Stream TE,Upside,"Skill positions dominated every early round in a calculated RB and WR rotation, with WRs revisited mid-draft, the tight end streamed entirely, and the quarterback punted to the final rounds before the kicker and defense, leaving boom-or-bust upside picks to fill every backend slot. The Chaos Builder designed the disorder from the first pick, the skill position foundation is the structure, the punted QB and streamed TE are the accelerant, and the upside backend is the match. The chaos was built intentionally. It is a feature."
336,The Robot Builder,✓,Hybrid,WR Mid,Punt QB,Stream TE,VBD,"Running backs and wide receivers were loaded deliberately through the early rounds, with WRs revisited mid-draft, the tight end streamed late, and the quarterback punted to the final rounds where value-based drafting runs the backend like a system that cannot be second-guessed. The Robot Builder assembled the roster using an automated process that rejected emotion at every position, skill positions early, WRs mid, QB punted, value-based drafting closing, and output the optimal roster without a single deviation. The build was systematic. The results were not accidental."
337,The Fortress,✓,Zero RB,Hero WR,Early QB,Early TE,Floor,"Zero RB commitment made, Hero WR anchored the receiving corps, early QB locked in, premium early TE, and a floor-first backend. The Fortress is impenetrable in the passing game, elite QB, top WR, and premium TE form a three-sided wall that holds up through any storm the season produces. The fortress stands."
338,The Two Towers,✓,Zero RB,Hero WR,Early QB,Early TE,Upside,"Zero RB with a Hero WR, early QB priority, premium early TE, and boom-or-bust upside picks filling the backend. The Two Towers rise above the positional landscape, the Hero WR and premium TE anchor both scoring positions and the upside backend fires long-range shots at the championship. Two towers. Maximum range."
339,The Dual Anchor,✓,Zero RB,Hero WR,Early QB,Early TE,VBD,"Zero RB alongside a Hero WR, early QB, premium early TE, and value-based drafting managing every backend pick with dual-anchor discipline. The Dual Anchor is exactly what the structure suggests, two elite position players anchoring the scoring, QB secured early, and value-based drafting filling every remaining slot. Two anchors. Zero drift."
341,The Star Collector,✓,Zero RB,Hero WR,Early QB,Mid TE,Upside,"Zero RB alongside a Hero WR, early QB, mid-round TE, and boom-or-bust upside picks collecting high-ceiling assets at every backend position. The Star Collector acquires elite pass-catchers and pairs them with an early QB and mid-round TE before drafting ceiling in every remaining round. The collection grows. The ceiling keeps rising."
342,The Synergist,✓,Zero RB,Hero WR,Early QB,Mid TE,VBD,"Zero RB with a Hero WR, early QB, mid-round TE, and value-based drafting building synergistic value across every backend pick. The Synergist builds passing game assets that amplify each other's value, the Hero WR with an early QB creates stacking opportunities, and value-based drafting locks in the rest. The synergy was real. The optimizer found it."
343,The Ironclad,✓,Zero RB,Hero WR,Early QB,Stream TE,Floor,"Zero RB with a Hero WR, early QB locked in, streamed TE, and a floor-first backend built with ironclad reliability. The Ironclad is forged from premium passing game investments, the WR anchor, the early QB, and reinforced with a floor-first backend that cannot be broken. Forged. Reinforced. Ironclad."
344,The Big Play,✓,Zero RB,Hero WR,Early QB,Stream TE,Upside,"Zero RB alongside a Hero WR, early QB, streamed TE, and boom-or-bust upside picks making big plays in every backend round. The Big Play makes its money in the passing game and bets that the upside backend delivers the explosive scoring weeks needed to win. The big plays are loaded. One fires every week."
345,The Executive,✓,Zero RB,Hero WR,Early QB,Stream TE,VBD,"Zero RB with a Hero WR, early QB, streamed TE, and value-based drafting executing the entire backend with the authority of a well-run front office. The Executive makes every pick decisively and with full information, the Zero RB framework is the corporate strategy, and value-based drafting is the quarterly earnings report. The executive delivered results."
