#,Archetype Name,Named?,RB Strategy,WR Strategy,QB Strategy,TE Strategy,Late Round Philosophy,Flavor Text
160,The Value Engineer,✓,Hero RB,WR Late,Late QB,Early TE,VBD,"Hero RB with late WRs, late QB taken at maximum value, early TE premium, and value-based drafting tracking the entire backend. The Value Engineer identifies inefficiency in every round and corrects it with the most defensible pick available. Every selection was engineered. Every value gap was closed."
161,The Reliable Duo,✓,Hero RB,WR Late,Late QB,Mid TE,Floor,"Hero RB paired with late WRs, late QB at a discount, mid-round TE, and a floor-first backend with reliable depth throughout. The Reliable Duo is exactly what the name says, the RB and TE are locked in every week, the rest fills in around them, and the team wins more than it loses. Reliability is repeatable."
208,The Twin Pillars,✓,Robust RB,Hero WR,Late QB,Stream TE,Floor,"Robust RB with a Hero WR, late QB at value, streamed TE, and a floor-first backend built for consistent weekly output. The Twin Pillars version two is still built around two reliable anchors, the Robust RB depth and the Hero WR, with everything else managed efficiently at value. The duo is different. The reliability is not."
163,The Late Bloomer,✓,Hero RB,WR Late,Late QB,Mid TE,Upside,"Hero RB with late WRs taken at value, late QB, mid-round TE, and boom-or-bust upside picks going deep in the backend. The Late Bloomer builds for the second half of the season, the late picks get cheaper and more explosive as the draft progresses, and this team is built to peak at the right time. The bloom is coming."
209,The Second Wind,✓,Robust RB,Hero WR,Late QB,Stream TE,Upside,"Robust RB alongside a Hero WR, late QB at great value, streamed TE, and boom-or-bust upside picks timing the backend for a late surge. The Second Wind with a Robust RB foundation has more ground-game security than its namesake, the RB depth provides the floor while the upside backend schedules the bloom. Two anchors. One bloom."
165,The Hard Hat,✓,Hero RB,WR Late,Late QB,Stream TE,Floor,"Hero RB with late WRs, late QB at a discount, streamed TE, and a floor-first backend filled with reliable depth. The Hard Hat clocks in every week and produces without complaint, no flashy moments, no fantasy headlines, just points in the box score and wins on the schedule. Clock in. Clock out. Win."
241,The Steel Toed,✓,Robust RB,WR Late,Late QB,Mid TE,Floor,"Robust RB depth with late WRs, late QB at a discount, mid-round TE, and a floor-first backend built on grind-ready reliability. The Steel Toed with Robust RB depth clocks in twice every week, once from the backfield and once from the WR corps, and produces without asking for recognition. Clock in. Clock out. Win."
167,The Bet Hedger,✓,Hero RB,WR Late,Late QB,Stream TE,Upside,"Hero RB alongside late WRs, late QB at value, streamed TE, and boom-or-bust upside picks hedging the entire backend. The Bet Hedger diversifies the risk, the RB anchors, the QB comes cheap, and every backend pick is a different kind of lottery ticket. The hedge is on. Multiple ways to win."
168,The Mileage,✓,Hero RB,WR Late,Late QB,Stream TE,VBD,"Hero RB with late WRs, late QB at maximum value, streamed TE, and value-based drafting executing the backend with total discipline. The Mileage logs every pick at positive expected value and runs the season the same way, efficiently, without waste, and with the depth to cover every lineup emergency. High mileage. Low friction."
169,The Fortress Wall,✓,Hero RB,WR Late,Mid QB,Early TE,Floor,"Hero RB alongside late WRs, mid-round QB, premium early TE, and a floor-first backend that won't surrender an easy week. The Fortress Wall combines the Hero RB anchor with a premium TE and lets the mid-round QB hold the line in between. Multiple walls. No gaps."
171,The Thunder,✓,Hero RB,WR Late,Mid QB,Early TE,Upside,"Hero RB with late WRs, mid-round QB, premium early TE, and boom-or-bust upside picks thundering through every backend round. The Thunder rolls early with the Hero RB and TE investments, then strikes hard with every backend swing pick. The ground shakes before the lightning lands."
172,The Return on Investment,✓,Hero RB,WR Late,Mid QB,Early TE,VBD,"Hero RB paired with late WRs, mid-round QB, early TE premium, and value-based drafting generating positive returns through every backend selection. The Return on Investment treats every draft pick as a capital allocation, the Hero RB is the core position, the TE is the alternative asset, and value-based drafting tracks the portfolio. The ROI is positive."
173,The Old School,✓,Hero RB,WR Late,Mid QB,Mid TE,Floor,"Hero RB with late WRs, mid-round QB, mid-round TE, and a floor-first backend that plays for the long game. The Old School doesn't need the analytics era to tell it what works. Hero RB, stacked depth, manageable QB cost, and a team that shows up every week. Old school still wins."
175,The Backfield Boss,✓,Hero RB,WR Late,Mid QB,Mid TE,Upside,"Hero RB with late WRs, mid-round QB, mid-round TE, and boom-or-bust upside picks all through the backend. The Backfield Boss establishes ground dominance in round one and builds the aerial attack in the backend with maximum swing picks. The backfield runs it. The boss calls the plays."
176,The Classicist,✓,Hero RB,WR Late,Mid QB,Mid TE,VBD,"Hero RB alongside late WRs, mid-round QB, mid-round TE, and value-based drafting running the backend operation without deviation. The Classicist builds the roster the way it has always been built. Hero RB at the top, WRs underneath, QB and TE at value, and value-based drafting closing every round. Classic. Still works."
177,The Traditionalist,✓,Hero RB,WR Late,Mid QB,Stream TE,Floor,"Hero RB with late WRs, mid-round QB, streamed TE, and a floor-first backend built around reliable depth at every spot. The Traditionalist doesn't need to experiment, the Hero RB philosophy has been producing winning teams for decades and the backend confirms every traditional wisdom. Tradition holds."
179,The Ground & Pound,✓,Hero RB,WR Late,Mid QB,Stream TE,Upside,"Hero RB with late WRs, mid-round QB, streamed TE, and boom-or-bust upside picks filling every backend slot. The Ground & Pound establishes the run game early and then attacks with high-ceiling picks through the rest of the draft. Pound the ground. Punch the upside."
180,The Arbitrageur,✓,Hero RB,WR Late,Mid QB,Stream TE,VBD,"Hero RB paired with late WRs, mid-round QB, streamed TE, and value-based drafting arbitraging value differentials through every backend pick. The Arbitrageur identifies price discrepancies between actual value and draft cost at every position and corrects them every single round. The spread was favorable. Every time."
181,The Iron Curtain,✓,Hero RB,WR Late,Punt QB,Early TE,Floor,"Hero RB with late WRs, QB fully punted, premium early TE, and a floor-first backend that refuses to give ground. The Iron Curtain drops at the RB and TE positions and dares the rest of the draft room to score. Impenetrable in the trenches. Uncompromising in the backend."
183,The Brute Force,✓,Hero RB,WR Late,Punt QB,Early TE,Upside,"Hero RB alongside late WRs, QB punt accepted, premium early TE, and boom-or-bust upside picks crashing through the backend. The Brute Force drafts without subtlety: Hero RB, premium TE, punt the QB, and swing hard on every remaining selection. Blunt. Direct. Dangerous."
184,The Sledgehammer,✓,Hero RB,WR Late,Punt QB,Early TE,VBD,"Hero RB with late WRs, QB fully punted, premium early TE, and value-based drafting driving every backend pick with maximum efficiency. The Sledgehammer hits the same spot every round, the most defensible value available, and builds a roster that's harder to beat than it is to build. The hammer dropped. The draft ended."
185,The Workhorse,✓,Hero RB,WR Late,Punt QB,Mid TE,Floor,"Hero RB anchored at the top, late WRs taken at value, QB punt accepted, mid-round TE, and a floor-first backend. The Workhorse builds around the player who touches the ball the most and stacks reliable depth behind it. Every week is a grind. The workhorse is built for it."
187,The Ground Game,✓,Hero RB,WR Late,Punt QB,Mid TE,Upside,"Hero RB with late WRs, QB fully punted, mid-round TE, and boom-or-bust upside picks filling every backend slot. The Ground Game is exactly what it says, establish the run, stack the upside, and let the backend swings decide the championship. The ground was established. The swings are loaded."
188,The Run First,✓,Hero RB,WR Late,Punt QB,Mid TE,VBD,"Hero RB paired with late WRs, QB punted completely, mid-round TE, and value-based drafting extracting maximum value through the backend. The Run First commits to the ground game as the draft identity and executes value-based drafting with the same discipline it uses to select running backs. Run the draft the same way. First."
189,The Bruiser,✓,Hero RB,WR Late,Punt QB,Stream TE,Floor,"Hero RB with late WRs, QB punt, streamed TE, and a floor-first backend built on reliable production above all else. The Bruiser takes the hits and keeps moving, a punted QB, streamed TE, and floor-first backend means this team produces without relying on volatility. Durable. Relentless."
262,The Battering Ram,✓,Robust RB,WR Late,Punt QB,Stream TE,Floor,"Robust RB investment with late WRs, QB fully punted, streamed TE, and a floor-first backend built to absorb any blow the schedule delivers. The Battering Ram with a Robust RB foundation hits harder than the single-back version, the depth at running back means the ground game never stops, even when the QB position is empty. Durable. Relentless. Every week."
191,The Lone Ranger,✓,Hero RB,WR Late,Punt QB,Stream TE,Upside,"Hero RB alongside late WRs, QB fully punted, streamed TE, and boom-or-bust upside picks taking swings through the entire backend. The Lone Ranger operates without the safety net of a reliable QB and trusts the upside picks to come through when it counts. Solo ride. High variance. Worth it."
192,The Run Committee,✓,Hero RB,WR Late,Punt QB,Stream TE,VBD,"Hero RB with late WRs, QB punt, streamed TE, and value-based drafting tracking the committee through every backend round. The Run Committee distributes the draft equity across every position except QB and uses value-based drafting to ensure every selection carries its weight. The committee voted. Value-based drafting ran the meeting."
193,The Blue Chip,✓,Robust RB,Hero WR,Early QB,Early TE,Floor,"Robust RB investment anchored the draft, Hero WR paired alongside it, early QB locked in, premium early TE, and a floor-first backend. The Blue Chip draft has the two most valuable assets in fantasy, the elite RB room and the premium receiver, surrounded by reliable supporting pieces. The chips were blue. The floor is high."
194,The Big Four,✓,Robust RB,Hero WR,Early QB,Early TE,Upside,"Robust RB depth established early, Hero WR alongside it, early QB on board, premium early TE, and boom-or-bust upside late. The Big Four locked up four premium positions before the middle rounds and built the backend on upside ceiling. Four big assets. One direction: up."
195,The Asset Manager,✓,Robust RB,Hero WR,Early QB,Early TE,VBD,"Robust RB with a Hero WR, early QB secured, premium early TE, and value-based drafting managing every backend pick with total precision. The Asset Manager identifies undervalued assets at every position and accumulates them systematically, the Robust RBs, the Hero WR, the early TE are all performing assets. The portfolio is stacked."
196,The Grand Slam,✓,Robust RB,Hero WR,Early QB,Mid TE,Floor,"Robust RB depth alongside a Hero WR, early QB locked in, mid-round TE, and a floor-first backend with no weak spots. The Grand Slam connects at every major position, the RBs, the WR, the QB, the TE, and builds out from there with conservative depth. Base hit on every pick. Grand slam on the roster."
197,The Big Three,✓,Robust RB,Hero WR,Early QB,Mid TE,Upside,"Robust RB with a Hero WR, early QB, mid-round TE, and boom-or-bust upside picks swinging hard through the backend. The Big Three locked up three premium offensive positions and dared the backend to deliver a championship. The three are big. The ceiling is bigger."
198,The GM,✓,Robust RB,Hero WR,Early QB,Mid TE,VBD,"Robust RB investment alongside a Hero WR, early QB, mid-round TE, and value-based drafting managing every remaining pick with precision. The GM runs the most complete front office in the draft room, the early investments are premium, the backend picks are optimal, and every roster decision is defensible. GMs build winners. This one did."
199,The Power Play,✓,Robust RB,Hero WR,Early QB,Stream TE,Floor,"Robust RB with a Hero WR, early QB, streamed TE, and a floor-first backend built around reliable weekly production. The Power Play sets up the formation with elite RBs and a top WR and runs it straight at the defense every week. The power is on. The play is called."
200,The Triple Header,✓,Robust RB,Hero WR,Early QB,Stream TE,Upside,"Robust RB depth alongside a Hero WR, early QB, streamed TE, and boom-or-bust upside picks filling every backend spot. The Triple Header puts three scoring threats on the field and backs them up with high-ceiling depth that can hit on any given week. Three ways to win. All of them active."
201,The Brass Tacks,✓,Robust RB,Hero WR,Early QB,Stream TE,VBD,"Robust RB with a Hero WR, early QB, streamed TE, and value-based drafting extracting every available unit of value through the entire backend. The Brass Tacks gets to the point: Robust RB, Hero WR, early QB, value-based drafting backend, no complexity, no overthinking, just the core principles applied without compromise. Tacks are in. Poster is up."
202,The Long Shot,✓,Robust RB,Hero WR,Late QB,Early TE,Floor,"Robust RB depth with a Hero WR, late QB taken at real value, premium early TE, and a floor-first backend. The Long Shot plays the odds, the Robust RBs and Hero WR are the reliable core, the late QB is the value play, and the floor-first backend is the insurance policy. Long shot. Solid floor."
204,The Underdog Play,✓,Robust RB,Hero WR,Late QB,Early TE,VBD,"Robust RB alongside a Hero WR, late QB at maximum value, early TE premium, and value-based drafting closing out the backend. The Underdog Play doesn't need every pick to hit, the Robust RB depth provides redundancy, the Hero WR anchors, and value-based drafting fills in around them with the most defensible picks available. The underdog always has a path."
205,The Reliable Roster,✓,Robust RB,Hero WR,Late QB,Mid TE,Floor,"Robust RB depth with a Hero WR, late QB at a discount, mid-round TE, and a floor-first backend that produces every week. The Reliable Roster has depth at every position, value at the QB and TE spots, and a floor-first backend that doesn't leave points on the bench. Reliability wasn't accidental. It was the goal."
206,The Late Surge,✓,Robust RB,Hero WR,Late QB,Mid TE,Upside,"Robust RB with a Hero WR, late QB at great value, mid-round TE, and boom-or-bust upside picks surging through the backend. The Late Surge builds the foundation first and saves the fireworks for the second half of the draft, and the second half of the season. The surge is loaded. Wait for it."
212,The Loaded Roster,✓,Robust RB,Hero WR,Mid QB,Early TE,Upside,"Robust RB with a Hero WR, mid-round QB, premium early TE, and boom-or-bust upside picks loading up the backend. The Loaded Roster is exactly what it sounds like, premium at RB, WR, and TE, reliable QB in the middle, and upside picks stacking the bench behind it. It's loaded. Handle accordingly."
213,The Complete Roster,✓,Robust RB,Hero WR,Mid QB,Early TE,VBD,"Robust RB alongside a Hero WR, mid-round QB, premium early TE, and value-based drafting running the backend with systematic precision. The Complete Roster checks every box, the RB depth, the WR anchor, the TE premium, the QB value, and the value-based backend. Every column has a number. Every number is positive."
214,The Balanced Attack,✓,Robust RB,Hero WR,Mid QB,Mid TE,Floor,"Robust RB depth with a Hero WR, mid-round QB, mid-round TE, and a floor-first backend built for consistent weekly output. The Balanced Attack doesn't need to win with any one position, it wins with balance, depth, and the inability to be targeted at a single weak spot. Every attack was balanced. Every week is covered."
215,The Dual Threat,✓,Robust RB,Hero WR,Mid QB,Mid TE,Upside,"Robust RB with a Hero WR, mid-round QB, mid-round TE, and boom-or-bust upside picks filling every backend slot. The Dual Threat runs it and throws it, the Robust RBs carry the ground game and the Hero WR commands the air, with the backend swings deciding the margin. Two threats. Multiple ways to score."
216,The Diversified,✓,Robust RB,Hero WR,Mid QB,Mid TE,VBD,"Robust RB alongside a Hero WR, mid-round QB, mid-round TE, and value-based drafting diversifying the backend across every available value. The Diversified holds positions in every category and manages the portfolio with the same analytical rigor applied to every single pick. No concentration risk. Maximum diversification."
217,The Coalition,✓,Robust RB,Hero WR,Mid QB,Stream TE,Floor,"Robust RB with a Hero WR, mid-round QB, streamed TE, and a floor-first backend built through collective reliability. The Coalition combines every ground-game asset with a receiving star, manages the QB and TE efficiently, and closes with a floor-first backend that never surrenders a week. The coalition holds."
340,The Alliance,✓,Zero RB,Hero WR,Early QB,Mid TE,Floor,"Zero RB with a Hero WR, early QB locked in, mid-round TE, and a floor-first backend. The Alliance brings together the pass-catching investments. Hero WR, early QB, and builds floor-first reliability around them. The coalition holds every week."
218,The Contrarian,✓,Robust RB,Hero WR,Mid QB,Stream TE,Upside,"Robust RB depth alongside a Hero WR, mid-round QB, streamed TE, and boom-or-bust upside picks going against the grain throughout. The Contrarian builds the team the room is avoiding and trusts that the unpopular combination is actually the correct one. The contrarian position is often the best one. Often is enough."
369,The Dissenter,✓,Zero RB,Hero WR,Punt QB,Mid TE,VBD,"Zero RB with a Hero WR, QB punt, mid-round TE, and value-based drafting identifying the contrarian value the room left on the board. The Dissenter disagrees with consensus at every position and builds the case with value-based drafting at every backend pick. The contrarian position was correct. Value-based drafting is the evidence."
219,The Diversified Portfolio,✓,Robust RB,Hero WR,Mid QB,Stream TE,VBD,"Robust RB with a Hero WR, mid-round QB, streamed TE, and value-based drafting diversifying the backend across multiple positions and values. The Diversified Portfolio holds assets in every fantasy category and rebalances through value-based drafting all the way to the final round. Diverse inputs. Optimized output."
224,The Chaos Theory,✓,Robust RB,Hero WR,Punt QB,Mid TE,Upside,"Robust RB alongside a Hero WR, QB fully punted, mid-round TE, and boom-or-bust upside picks shattering conventional wisdom. The Chaos Theory generates unpredictable outcomes from organized inputs, the Robust RBs and Hero WR are the structure, the punted QB and upside backend are the chaos. Theory confirmed."
225,The Spartan,✓,Robust RB,Hero WR,Punt QB,Mid TE,VBD,"Robust RB depth with a Hero WR, QB punt accepted, mid-round TE, and value-based drafting extracting every unit of value from the backend. The Spartan eliminates waste at the QB position and redirects the value saved into the deepest, most defensible roster possible. No excess. Only necessity."
406,The Stripped Down,✓,Zero RB,Robust WR,Punt QB,Stream TE,Floor,"Zero RB alongside heavy Robust WR depth, QB punt, streamed TE, and a floor-first backend. The Stripped Down has no room for luxury: Zero RB, punted QB, streamed TE, and a floor-first backend mean every resource was deployed at WR depth. Nothing wasted. No luxuries. Results only."
226,The Iron Will,✓,Robust RB,Hero WR,Punt QB,Stream TE,Floor,"Robust RB alongside a Hero WR, QB punted entirely, streamed TE, and a floor-first backend built with iron discipline. The Iron Will bends around the absence of a reliable QB and holds together through sheer depth and floor-first discipline at every remaining position. The will is iron. The roster holds."
227,The Maverick's Mirror,✓,Robust RB,Hero WR,Punt QB,Stream TE,Upside,"Robust RB with a Hero WR, QB punt, streamed TE, and boom-or-bust upside picks filling the backend with maximum variance. The Maverick's Mirror reflects the original approach, punt the conventional, chase the ceiling, trust the process even when nobody else does. The reflection is correct. So is the roster."
228,The Stoic's Formula,✓,Robust RB,Hero WR,Punt QB,Stream TE,VBD,"Robust RB depth alongside a Hero WR, QB fully punted, streamed TE, and value-based drafting driving the backend with systematic discipline. The Stoic's Formula accepts the discomfort of the punted QB and executes value-based drafting through the backend without emotional interference. The formula doesn't require comfort. Just execution."
229,The Power Formation,✓,Robust RB,WR Late,Early QB,Early TE,Floor,"Robust RB investment anchored the formation, late WRs added at value, early QB locked in, premium early TE, and a floor-first backend. The Power Formation stacks the ground game first, secures the signal-caller early, anchors the TE position, and fills in the WRs at value behind it. The formation is set. Run the play."
230,The Triple Crown,✓,Robust RB,WR Late,Early QB,Early TE,Upside,"Robust RB with late WRs, early QB priority, premium early TE, and boom-or-bust upside picks sweeping through the backend. The Triple Crown claims three distinct positional titles, the RB room, the early QB, and the premium TE, then rides upside swings to the finish line. The crown has three points. All three are set."
231,The War Room General,✓,Robust RB,WR Late,Early QB,Early TE,VBD,"Robust RB alongside late WRs, early QB, premium early TE, and value-based drafting running the entire backend operation. The War Room General maps the entire draft before pick one and executes the playbook without improvisation. The war room prepared. The general delivered."
233,The Triple Threat,✓,Robust RB,WR Late,Early QB,Mid TE,Upside,"Robust RB with late WRs, early QB, mid-round TE, and boom-or-bust upside picks threatening at every backend spot. The Triple Threat attacks from three directions, the ground game, the signal-caller, and the upside swings, and forces the schedule to defend all of them simultaneously. Three threats. One direction."
234,The Draft Board,✓,Robust RB,WR Late,Early QB,Mid TE,VBD,"Robust RB depth with late WRs, early QB, mid-round TE, and value-based drafting building the entire backend from a ranked list. The Draft Board trusts the board completely, the early picks are premium, the QB is secured, and value-based drafting handles every decision from round five onward. The board was correct. It always is."
235,The Formation,✓,Robust RB,WR Late,Early QB,Stream TE,Floor,"Robust RB alongside late WRs, early QB secured, streamed TE, and a floor-first backend built on consistent production. The Formation sets up the ground game, locks in the signal-caller early, and fills the remaining positions with reliable floor-first pieces. The formation is locked. Run it every week."
236,The Gambler's Gambit,✓,Robust RB,WR Late,Early QB,Stream TE,Upside,"Robust RB with late WRs, early QB, streamed TE, and boom-or-bust upside picks executing the most aggressive backend gambit available. The Gambler's Gambit locks in the safe investments first, the RBs and QB, then swings on everything else. The gambit was set before the draft started. The chips are all in."
237,The Draft Room,✓,Robust RB,WR Late,Early QB,Stream TE,VBD,"Robust RB alongside late WRs, early QB, streamed TE, and value-based drafting managing every backend selection with the precision of a scouting department. The Draft Room runs the process the way it was designed, early positional priority, QB secured, value-based drafting closing, and the roster reflects every decision made correctly. The room produced."
239,The Trenches,✓,Robust RB,WR Late,Late QB,Early TE,Upside,"Robust RB depth with late WRs, late QB at real value, premium early TE, and boom-or-bust upside picks attacking from the backend. The Trenches wins in the line of scrimmage, the RBs and TE are the premium investments, the QB is the value find, and the backend swings are the fourth quarter surge. Win in the trenches. Win the league."
240,The Return on Rushes,✓,Robust RB,WR Late,Late QB,Early TE,VBD,"Robust RB with late WRs, late QB at a discount, premium early TE, and value-based drafting extracting maximum value through every backend pick. The Return on Rushes calculates the value generated by every ground-game carry and applies the same principle to every draft pick. The return was positive at every position."
242,The Lottery Ticket,✓,Robust RB,WR Late,Late QB,Mid TE,Upside,"Robust RB alongside late WRs, late QB at value, mid-round TE, and boom-or-bust upside picks stacking every backend slot. The Lottery Ticket buys all of them, the Robust RBs are the certain investment, the late QB is the value play, and every backend pick is a ticket stub. One of them hits. That's enough."
243,The Value Play,✓,Robust RB,WR Late,Late QB,Mid TE,VBD,"Robust RB depth with late WRs, late QB, mid-round TE, and value-based drafting running the backend with clean mathematical discipline. The Value Play runs the same calculation every round, which player returns the most value relative to position scarcity, and executes without sentiment. Every pick was a value play. The value played."
