#,Archetype Name,Named?,RB Strategy,WR Strategy,QB Strategy,TE Strategy,Late Round Philosophy,Flavor Text
366,The Dispassionate,✓,Zero RB,Hero WR,Punt QB,Early TE,VBD,"Zero RB alongside a Hero WR, QB punt accepted, premium early TE, and value-based drafting building a cold, analytical backend. The Dispassionate views the draft without sentiment. Zero RB is the logical stance, QB punt is the value maximization, premium TE is the positional edge, and value-based drafting confirms every pick was correct. No emotion. Only analysis."
69,The Disciplined Pro,✓,BPA,WR Late,Late QB,Stream TE,Floor,"best player available, stream TE, late QB at tremendous value, late WRs, and a dependable floor-first bench. The Disciplined Pro has been burned by flashy rosters before and builds exclusively for reliability. Experience turned into discipline. Discipline turned into this roster."
71,The Stoic,✓,BPA,WR Late,Late QB,Stream TE,Upside,"best player available, stream TE, late QB, late WRs, and boom-or-bust picks, drafted without a single flinch or second guess. The Stoic approached the entire draft with complete emotional detachment and zero outcome anxiety. The picks are made. The process was sound. Whatever happens next was always going to happen."
370,The Unflinching,✓,Zero RB,Hero WR,Punt QB,Stream TE,Floor,"Zero RB with a Hero WR, QB punt committed, streamed TE, and a floor-first backend. The Unflinching accepts every uncomfortable trade-off. Zero RB, punted QB, no TE premium, without flinching and builds a floor-first backend that holds together regardless of the circumstances. Stoic in approach. Steady in production."
72,The Pure BPA,✓,BPA,WR Late,Late QB,Stream TE,VBD,"Best player available every single pick, late QB, stream TE, late WRs, value-based drafting late, the platonic ideal of the strategy. The Pure best player available is the most honest possible approach to fantasy drafting: trust the ranked list, always. There was no other voice in the room."
76,The Long Game,✓,BPA,WR Late,Mid QB,Early TE,VBD,"best player available, premium TE, mid-round QB at value, late WRs, and value-based drafting all the way to the final pick. The Long Game isn't worried about week 1, it's worried about week 14, when the field is thinned and this roster peaks. Patience is the entire strategy. The patience was real."
351,The Marathon,✓,Zero RB,Hero WR,Late QB,Mid TE,VBD,"Zero RB with a Hero WR, late QB at value, mid-round TE, and value-based drafting playing the long game through the entire backend. The Marathon is not designed for week three, the late QB is a value investment that compounds, the Hero WR is the steady asset, and value-based drafting makes every backend pick a long-term holding. The game is long. This team finishes it."
77,The Contrarian's Cousin,✓,BPA,WR Late,Mid QB,Mid TE,Floor,"Pure best player available, mid-round QB and TE, late WRs, and a conservative floor-first bench with no unnecessary risk. The Contrarian's Cousin goes against the grain quietly, no announcements, no explanations needed. The board led here and the board is not wrong."
79,The Underdog,✓,BPA,WR Late,Mid QB,Mid TE,Upside,"best player available produced a reliable mid-round QB and TE. WRs deferred, then boom-or-bust picks everywhere late. The Underdog was counted out in the draft room. They will remember that feeling around week 8. It was assembled quietly and it is going to cause problems."
80,The Arbitrage,✓,BPA,WR Late,Mid QB,Mid TE,VBD,"best player available, mid-round QB and TE at value, late WRs, and value-based drafting finding price discrepancies all the way down. The Arbitrage finds the spread between price and value and profits from every single one. The inefficiencies were real. They were all exploited."
81,The Workhorse's Cousin,✓,BPA,WR Late,Mid QB,Stream TE,Floor,"best player available gave you a mid-round QB, stream TE, late WRs, and a reliable dependable bench. The Workhorse's Cousin works just as hard as the Workhorse, with a slightly more flexible origin story. It shows up every week. That's the whole job."
83,The Dark Horse,✓,BPA,WR Late,Mid QB,Stream TE,Upside,"best player available, mid-round QB, stream TE, late WRs, and high-ceiling boom-or-bust picks filling the backend. The Dark Horse isn't on anyone's preseason radar, which is precisely how this drafter planned it. Being underestimated is a competitive advantage."
203,The Longshot Contender,✓,Robust RB,Hero WR,Late QB,Early TE,Upside,"Robust RB with a Hero WR, late QB at value, premium early TE investment, and upside picks swinging for the fences late. The Longshot Contender is the team nobody picked in the preseason preview but is somehow leading the league by October. The shadow was deliberate. So was the roster."
84,The Smart Money,✓,BPA,WR Late,Mid QB,Stream TE,VBD,"best player available, mid-round QB on value, stream TE, late WRs, and value-based drafting all the way to the final pick. The Smart Money knows something the rest of the room doesn't, and bet accordingly at every turn. The market was mispriced. This drafter noticed first."
210,The Informed Edge,✓,Robust RB,Hero WR,Late QB,Stream TE,VBD,"Robust RB paired with a Hero WR, late QB taken at great value, streamed TE, and value-based drafting tracking every late-round pick. The Informed Edge identifies inefficiencies in the draft room and exploits them systematically from start to finish. The edge isn't luck. It's process."
85,The Steady Maverick,✓,BPA,WR Late,Punt QB,Early TE,Floor,"best player available gave you a premium TE, punted QB, late WRs, and a steady reliable bench with a high floor. The Steady Maverick is unconventional at the top of the draft, and completely responsible everywhere else. Bold where it counts, reliable where it must be."
87,The Maverick,✓,BPA,WR Late,Punt QB,Early TE,Upside,"best player available led to a premium TE, punted QB entirely, late WRs, and boom-or-bust picks all the way down. The Maverick follows the board wherever it goes, even when it goes somewhere nobody else would follow. The board led here. The Maverick had no hesitation."
111,The Outlier,✓,Hero RB,Robust WR,Late QB,Early TE,Upside,"Hero RB with full WR investment, late QB at real value, premium early TE, and boom-or-bust upside swinging through the backend. The Outlier takes the path nobody else is walking and trusts the conviction all the way to the final round. Unconventional was the point. Upside was the reward."
88,The Data Driven,✓,BPA,WR Late,Punt QB,Early TE,VBD,"best player available, premium TE, punted QB, late WRs, and value-based drafting all the way to the final pick, the data made every call. The Data Driven let the numbers make every single decision and never once overrode the signal. The data was consulted. The data was correct."
89,The Controlled Burn,✓,BPA,WR Late,Punt QB,Mid TE,Floor,"best player available, mid-round TE, punted QB, late WRs, and a reliable floor-first bench with no unnecessary risk. The Controlled Burn eliminates the deadwood without burning down the whole forest. Careful, deliberate, and surprisingly effective."
91,The Wildcard,✓,BPA,WR Late,Punt QB,Mid TE,Upside,"best player available led to a punted QB, mid-round TE, late WRs, and boom-or-bust picks that nobody in the room predicted. The Wildcard is impossible to game-plan against because nobody knows what card is coming next. Including, possibly, this drafter."
92,The Quant,✓,BPA,WR Late,Punt QB,Mid TE,VBD,"best player available, mid-round TE, punted QB, late WRs, and value-based drafting all the way down, the quantitative approach in its purest form. The Quant ran the regression, found punt QB to be the correct output, and acted on it without hesitation. The math was done. The math was right."
402,The Modeler,✓,Zero RB,Robust WR,Punt QB,Early TE,VBD,"Zero RB alongside deep Robust WR investment, QB fully punted, premium early TE, and value-based drafting quantifying every unit of value from the backend. The Modeler ran the models before the draft, confirmed the Zero RB and premium TE thesis with the data, punted QB as the model suggested, and used value-based drafting to validate every pick from round five on. The model was correct."
93,The Minimalist Pro,✓,BPA,WR Late,Punt QB,Stream TE,Floor,"best player available, punted QB, stream TE, late WRs, and a lean reliable backend, everything unnecessary was cut. The Minimalist Pro is efficient by nature, not by effort, the simplest approach that still works. Less is more. This roster is proof."
95,The Free Spirit,✓,BPA,WR Late,Punt QB,Stream TE,Upside,"best player available, punted QB, stream TE, late WRs, and boom-or-bust picks everywhere late, no rules, no agenda. The Free Spirit goes wherever the vibes take them, and the vibes apparently led somewhere with real upside. No plan. Great result. That's the spirit."
96,The Pure Value,✓,BPA,WR Late,Punt QB,Stream TE,VBD,"best player available, punted QB, stream TE, late WRs, and value-based drafting driving every remaining pick without exception. The Pure Value doesn't draft, it harvests, round after round, extracting maximum value from minimum investment. The harvest was excellent."
97,The Empire,✓,Hero RB,Robust WR,Early QB,Early TE,Floor,"Elite RB anchor, WRs stacked, early QB, premium TE, and a conservative dependable bench. The Empire is built to dominate sustainably, methodically, without unnecessary risk, and without apology. It's not exciting. It's relentless. Those things are not the same."
99,The Franchise,✓,Hero RB,Robust WR,Early QB,Early TE,Upside,"A top-tier RB, a wall of WRs, an early QB, and a premium TE, four pillars secured in four rounds. The Franchise built a roster that looks like a dynasty waiting to happen and swings for the fences late. Premium assets at every position. This is what a franchise looks like."
100,The Dynasty,✓,Hero RB,Robust WR,Early QB,Early TE,VBD,"You locked up premium picks at every position and let pure value guide every remaining pick all the way down. The Dynasty is the draft that future leagues will measure themselves against, the benchmark everyone chases. It is exactly that good."
101,The Ironclad Plan,✓,Hero RB,Robust WR,Early QB,Mid TE,Floor,"Hero RB anchored early, stacked WR depth alongside it, early QB secured, mid-round TE, and a floor-first backend to close. The Ironclad Plan was written before the draft started and executed without a single line crossed out. There are no question marks on this roster. That was the whole plan."
103,The Power Broker,✓,Hero RB,Robust WR,Early QB,Mid TE,Upside,"Hero RB leading the way, heavy WR investment built around it, early QB locked in, mid-round TE, and boom-or-bust upside late. The Power Broker makes big commitments early and dares the rest of the league to match them. Bold picks. Bigger expectations."
232,The Freight Train,✓,Robust RB,WR Late,Early QB,Mid TE,Floor,"Robust RB depth with WRs added late, early QB locked in, mid-round TE, and a floor-first backend. The Freight Train with a Robust RB approach locks up the ground game and the signal-caller simultaneously, the broker made two big deals before anyone else at the table was ready. The deals were made. The roster reflects them."
104,The Executive Suite,✓,Hero RB,Robust WR,Early QB,Mid TE,VBD,"Hero RB with stacked WRs, early QB, mid-round TE, and value-based drafting running the entire backend operation with precision. The Executive Suite runs the most efficient front office in the league, every pick was a trade up in value, every round an opportunity captured. The suite doesn't make bad deals."
105,The General,✓,Hero RB,Robust WR,Early QB,Stream TE,Floor,"Hero RB paired with deep WR investment, early QB priority, streamed TE, and a floor-first backend that refuses to crack. The General doesn't leave the backfield position to chance, anchor it early, stack the receiving corps, and manage the rest. The plan was simple. It worked."
107,The Bold Franchise,✓,Hero RB,Robust WR,Early QB,Stream TE,Upside,"Hero RB with stacked WRs, early QB on board, streamed TE, and boom-or-bust upside picks occupying every backend slot. The Bold Franchise commits fully to the high-variance path and believes the ceiling is worth every risk taken to get there. The franchise bet on upside. The franchise usually wins."
108,The War Room,✓,Hero RB,Robust WR,Early QB,Stream TE,VBD,"Hero RB alongside deep WR stacking, early QB secured, streamed TE, and value-based drafting extracting value through every remaining round. The War Room analyzed every available option before each pick and chose the most defensible one every single time. The analysis was thorough. The room produced results."
109,The Stronghold,✓,Hero RB,Robust WR,Late QB,Early TE,Floor,"Hero RB anchored at the top, heavy WR depth behind it, late QB at excellent value, premium early TE investment, and a floor-first close. The Stronghold was built to withstand pressure from every direction, every position group has depth, every weakness has a contingency. Fortifications complete."
112,The Librarian,✓,Hero RB,Robust WR,Late QB,Early TE,VBD,"Hero RB with stacked WRs, late QB taken at value, early TE premium, and value-based drafting methodically tracking every late pick. The Librarian has read every research paper on draft theory and applied the findings to every single selection. Every pick is catalogued. Every outcome is expected."
113,The Veteran,✓,Hero RB,Robust WR,Late QB,Mid TE,Floor,"Hero RB with deep WR investment, late QB at value, mid-round TE, and a floor-first backend built for a long season. The Veteran has been here before, knows which spots to target, which positions to avoid reaching for, and how to build depth without flinching. Experience drafted this team."
115,The Upside Seeker,✓,Hero RB,Robust WR,Late QB,Mid TE,Upside,"Hero RB alongside heavy WR investment, late QB at excellent value, mid-round TE, and upside picks swinging for the fences late. The Upside Seeker found the RB anchor first, stacked the WRs, grabbed the QB late at a discount, and spent the rest of the draft on lottery tickets. The ceiling is real. So is the risk."
119,The Bold,✓,Hero RB,Robust WR,Late QB,Stream TE,Upside,"Hero RB with stacked WRs, late QB at tremendous value, streamed TE, and boom-or-bust picks filling the entire backend. The Bold commits to the big-swing philosophy and accepts that the outcome will be memorable either way. There is no floor here. Only ceiling."
120,The Methodical,✓,Hero RB,Robust WR,Late QB,Stream TE,VBD,"Hero RB paired with deep WR depth, late QB grabbed at real value, streamed TE, and value-based drafting driving every remaining selection. The Methodical builds slowly, deliberately, and without a wasted pick from the first round to the last. The method is boring. The results are not."
121,The TE Hoarder,✓,Hero RB,Robust WR,Mid QB,Early TE,Floor,"Hero RB with full WR investment, mid-round QB, premium early TE, and a floor-first backend designed for reliability above all else. The TE Hoarder saw the early TE as non-negotiable and built the rest of the team around that anchor. Two premium positions locked in. The floor is very high."
123,The Hero,✓,Hero RB,Robust WR,Mid QB,Early TE,Upside,"Hero RB alongside heavy WRs, mid-round QB, premium early TE, and boom-or-bust upside picks in every backend slot. The Hero has a clear identity, the RB carries the team, the TE holds the corner, and the WRs light up the scoreboard on the big weeks. It's a starring role. The hero is ready."
124,The Stack Master,✓,Hero RB,Robust WR,Mid QB,Early TE,VBD,"Hero RB with stacked WRs, mid-round QB, early TE premium, and value-based drafting closing out the backend without deviation. The Stack Master builds layers, the RB is the foundation, the WRs are the walls, and value-based drafting is the roof that holds the whole structure together. Masterfully stacked."
125,The Bulwark,✓,Hero RB,Robust WR,Mid QB,Mid TE,Floor,"Hero RB paired with deep WR investment, mid-round QB, mid-round TE, and a floor-first backend with no weak links. The Bulwark is immovable, there is no lineup slot that can't produce, no roster spot that was wasted, no week where this team is a pushover. Built to not break."
127,The Complete Package,✓,Hero RB,Robust WR,Mid QB,Mid TE,Upside,"Hero RB with full WR depth, mid-round QB, mid-round TE, and boom-or-bust upside picks closing out the backend. The Complete Package has everything the lineup needs, the ground game, the air game, and enough upside in the backend to make a deep run. This team does it all."
128,The Fundamentalist,✓,Hero RB,Robust WR,Mid QB,Mid TE,VBD,"Hero RB with stacked WRs, mid-round QB, mid-round TE, and value-based drafting as the operating principle from round six to the end. The Fundamentalist believes in the fundamentals of draft theory and refuses to deviate regardless of what the room is doing. The fundamentals held. They always do."
129,The Conservative,✓,Hero RB,Robust WR,Mid QB,Stream TE,Floor,"Hero RB alongside heavy WR investment, mid-round QB, streamed TE, and a floor-first backend that plays it safe every week. The Conservative knows that the safest roster is the one still in contention in week fourteen. No fireworks. Just wins."
355,The Cautious,✓,Zero RB,Hero WR,Mid QB,Early TE,Floor,"Zero RB strategy with a Hero WR, mid-round QB, early premium TE, and a floor-first backend. The Cautious chose the Zero RB path with all three major positions managed carefully, mid-round QB at value, premium TE, and a floor-first backend that holds position every week. Conservative. Correct."
131,The Air Raid Classic,✓,Hero RB,Robust WR,Mid QB,Stream TE,Upside,"Hero RB with deep WR stacking, mid-round QB, streamed TE, and boom-or-bust upside picks throughout the entire backend. The Air Raid Classic runs it through the air at every position except the backfield, the Hero RB is the anchor, everything else is a target. The ball is in the air. Catch it."
398,The Air Raid Zero,✓,Zero RB,Robust WR,Mid QB,Stream TE,Upside,"Zero RB alongside stacked Robust WRs, mid-round QB, streamed TE, and boom-or-bust upside picks running the air raid through the backend. The Air Raid Zero runs the same play every year, stack WRs, grab the QB in the middle rounds, skip the RBs entirely, and swing for the ceiling late. Classic play. Classic result."
133,The Reliable,✓,Hero RB,Robust WR,Punt QB,Early TE,Floor,"Hero RB with heavy WR investment, QB punted entirely, premium early TE locked in, and a floor-first backend to close. The Reliable built this team to produce every single week regardless of matchup, weather, or circumstance. The floor is high enough that the ceiling doesn't need to be."
135,The Wildcatter,✓,Hero RB,Robust WR,Punt QB,Early TE,Upside,"Hero RB alongside stacked WRs, QB punt accepted, premium early TE, and boom-or-bust upside picks filling the backend. The Wildcatter drills deep into every round looking for the reservoir of value nobody else found. Some wells hit. The wildcatter drills anyway."
136,The Systematic,✓,Hero RB,Robust WR,Punt QB,Early TE,VBD,"Hero RB with deep WR investment, QB fully punted, early TE premium, and value-based drafting tracking the backend with mathematical precision. The Systematic built a process and followed it, the Hero RB was the cornerstone, the TE the second premium, and value-based drafting the blueprint for every remaining selection. The system produced results."
137,The Enduring,✓,Hero RB,Robust WR,Punt QB,Mid TE,Floor,"Hero RB with stacked WRs, QB punted for maximum value elsewhere, mid-round TE, and a floor-first backend built to last. The Enduring endures, the punted QB position is a discomfort accepted, the floor-first backend is a philosophy adopted, and the team is built to survive every variance the season produces. Endurance is the strategy."
139,The Gambit,✓,Hero RB,Robust WR,Punt QB,Mid TE,Upside,"Hero RB paired with heavy WR depth, QB punt accepted, mid-round TE, and upside picks swinging hard through the backend. The Gambit sacrifices the quarterback position to load up everywhere else and bets that the swing picks in the backend pay off at the right moment. The gambit is set. Now wait."
140,The Methodist,✓,Hero RB,Robust WR,Punt QB,Mid TE,VBD,"Hero RB with stacked WRs, QB punted, mid-round TE, and value-based drafting executing every backend pick with the precision of a denomination register. The Methodist follows the doctrine: Hero RB first, WRs stacked behind it, QB punted for maximum value at other positions, value-based drafting closing the sermon. Amen."
141,The Blue Collar,✓,Hero RB,Robust WR,Punt QB,Stream TE,Floor,"Hero RB anchored early, deep WR investment behind it, QB punted completely, streamed TE, and a floor-first backend built on grit. The Blue Collar punts the glamour position and builds the roster on the players who show up every week and do their job. No stars required. Just production."
143,The Lone Wolf,✓,Hero RB,Robust WR,Punt QB,Stream TE,Upside,"Hero RB with full WR investment, QB punt, streamed TE, and boom-or-bust upside picks taking swings all the way through the backend. The Lone Wolf operates without the QB crutch, trusts the RB anchor, and swings for ceiling in every remaining selection. Solo operation. Maximum range."
144,The Spartan General,✓,Hero RB,Robust WR,Punt QB,Stream TE,VBD,"Hero RB alongside heavy WRs, QB fully punted, streamed TE, and value-based drafting extracting every unit of value from the backend. The Spartan General commands without excess, the QB position is a sacrifice, the WRs are the army, and value-based drafting is the battle plan. Discipline. Precision. Victory."
145,The Sure Thing,✓,Hero RB,WR Late,Early QB,Early TE,Floor,"Hero RB with WRs taken late across the board, early QB priority established, premium early TE investment, and a floor-first backend. The Sure Thing builds around certainties, the elite RB, the premium TE, the reliable QB, and lets the late WRs add depth behind it. Certain foundation. Solid structure."
238,The Certainty,✓,Robust RB,WR Late,Late QB,Early TE,Floor,"Robust RB with late WRs, late QB at excellent value, premium early TE, and a floor-first backend. The Certainty anchors both skill positions, the Robust RB room and the premium TE, and gets the QB at tremendous value late. Two sure things locked in. The late QB was the third."
147,The Luxury Tax,✓,Hero RB,WR Late,Early QB,Early TE,Upside,"Hero RB with late WRs taken at value, early QB locked in, premium early TE, and boom-or-bust upside filling the backend. The Luxury Tax pays a premium for the RB, the QB, and the TE, then collects upside at a discount in the backend rounds. Premium inputs. Explosive potential output."
148,The Balance Sheet,✓,Hero RB,WR Late,Early QB,Early TE,VBD,"Hero RB paired with late WRs at value, early QB, premium early TE, and value-based drafting tracking every backend selection. The Balance Sheet runs every pick through a cost-benefit analysis and ensures the value column always wins. Every asset was purchased below market. The books prove it."
149,The Blueprint,✓,Hero RB,WR Late,Early QB,Mid TE,Floor,"Hero RB with WRs taken late, early QB secured, mid-round TE, and a floor-first backend built for consistent production. The Blueprint was drawn before the first pick and followed without revision, the Hero RB is the load-bearing wall, everything else is built to spec. Plans don't deviate. Neither did this draft."
373,The Schematic,✓,Zero RB,Robust WR,Early QB,Early TE,Floor,"Zero RB strategy committed, heavy Robust WR investment built alongside it, early QB locked in, premium early TE, and a floor-first backend. The Schematic was drawn before the first pick and followed without a single revision. Zero RB as the architecture, early QB and TE as the load-bearing walls, and a floor-first backend as the foundation. Plans don't deviate. Neither did this draft."
151,The Signal Caller,✓,Hero RB,WR Late,Early QB,Mid TE,Upside,"Hero RB alongside late WRs, early QB locked in, mid-round TE, and boom-or-bust upside picks filling the backend. The Signal Caller has a clear chain of command, the QB sets the tone, the RB carries the ground game, and the backend swings for the big play. The signal was sent. The backend received it."
155,The Franchise QB,✓,Hero RB,WR Late,Early QB,Stream TE,Upside,"Hero RB with WRs taken late, early QB on the board, streamed TE, and boom-or-bust upside picks through every backend round. The Franchise QB built around the signal-caller first and stacked the skill positions behind the arm talent. The franchise believes in the QB. The QB had better deliver."
157,The Immovable Object,✓,Hero RB,WR Late,Late QB,Early TE,Floor,"Hero RB with late WRs, late QB at real value, premium early TE, and a floor-first backend that refuses to give anything away. The Immovable Object cannot be dislodged, every lineup slot produces, every week is covered, and the roster generates points even when everything else in the league is broken. Unmovable. Unstoppable."
159,The Cornerstone,✓,Hero RB,WR Late,Late QB,Early TE,Upside,"Hero RB paired with late WRs, late QB at value, premium early TE, and boom-or-bust upside picks through the backend. The Cornerstone stakes the entire structure on two premium investments and builds the rest with ceiling-chasing picks at value. The cornerstone is set. The ceiling is wherever the picks land."
211,The Load Bearing,✓,Robust RB,Hero WR,Mid QB,Early TE,Floor,"Robust RB depth anchored alongside a Hero WR, mid-round QB, premium early TE, and a floor-first backend. The Load Bearing stakes the structure on three premium positions, the Robust RBs, the WR, and the TE, and builds reliable floor around them. Three cornerstones. Unshakeable structure."
